date_utc,timestamp,title,text,subreddit,comments,url
2023-10-29,1698616663,"Sweet dreams, my Lottie","Currently in tears, so mind any grammar mistakes. This may be a bit of a long one...

This is Lottie, and she is my soulmate. And she died today, hit by a car. I'm still in disbelief, but have been crying since I've woken up this morning. 

2 years old, and everyone agreed she was ""my"" cat, despite legally belonging to my mother. She'd wait for me, lick me, nearly gave birth to her two kittens on me this February. 
She would ask to go ""under""neath blankets and would get all warm and cozy atop of me. (2nd pic).

 She was a quiet, and a professional seeming cat around everyone else, but around me, she truly acted like a kitten, and my bestest friend. There wasn't one day that went by where I didn't think of coming home to her and snuggling with her. She had very cute and unique habits, and is the most intelligent cat I've ever owned. 

Put my fingers on her paw, she'd grab it with her claws. Stroke her? She'll purr her head off, and eventually start licking her fingers. She had the quietest meow, and only purred loud if I was there with her. When her kittens became more playful, she'd show them to hunt, and would bring them toys. She once brought a fake fish ornament into the garden which she had stolen, and would waddle them over a stick toy with a mouse on the end. She would bring them the occasional leaf too. 

She loved being cuddled while under the covers, or in cozy confined spaces, she felt so safe around me. I would leave to my dads on weekends, and she'd eagerly wait for me to return on Sundays. 

Early hours this morning, she was hit by a car, and most likely died instantly. Likewise, I knew instantly, that she was involved in an accident because it was unusual for her not to come to me on mornings. Truth was, she was dead at that point. 

But certain police van was nearbye, and retrieved her body, before going to the nearest vet. In my country, this is not standard practice, the police went out of their way to do this, and meant, though she had already passed, I could see her and stroke her one last time. I told her all my plans I would've done with her, told her about how much I loved her, and that I'll take care of her kittens for her, and hopefully be reunited in the afterlife, where we could finally redeem those stolen moments we shouldve had together. 

I disagree with the notion that ""everyone has their time."" Lottie was killed, and her time was stolen from her. If the universe wanted to send a message any more clear than having policemen take her body to a kind vet, and just so happen to be around, and then just so happen to care when it's discouraged from their role (as the police admin woman told me), then this was it. It wasn't her time, and literal justice was there to make sure her body wasn't injured further. 

The only silver lining however, I realized, is a great big chain of causation, that I started. My local area was a Red Light District before I moved in, and I was at the forefront of the protests to end the crimes, for the safety of the community. This was back in 2016, up to 2020. And the protest won, after my story was heard by a local councillor. This increased police patrols in the area. Fast forward to today, it was one of those policemen, who most likely wouldn't have been there had it not been for my protests, to give her to a vet. 


It hurts so much. And I have lost other kittens before too, but everyone, even non-family members considered me and her to be soulmates. And I don't disagree. I'll be getting a tattoo of her paw print, so she'll always be with me in a way, for all those stolen moments. And the worst part is, if there is an afterlife, I doubt she'd be happy up there without me, just emphasizing her love and dependence she gave to me. And I won't be happy here without her either, but I have to look after her kittens, they'll miss her alot,, keep her memory, hopefully be reunited eventually in whatever way. Me and my bestest friend

That last pic was the last pic I ever took of her (yesterday) after I spoilt her with love. This whole post will never recapture Lottie, or preserve her little quirks or personality, but Id like to think, those actions in the past, meant that that policeman was in the area, and eventhough I wasn't there, it was only fitting that my actions would give her a peaceful goodbye after her death. 

Sweet dreams Lottie-naughtie. I love you so much. Hope we meet again, and that even in a spirit form, you never leave my side. 
You don't know how much I miss you already. ee=",cats,4,https://www.reddit.com/r/cats/comments/17jdsbk/sweet_dreams_my_lottie/
2023-10-28,1698499013,Self-nursing kitten...,"Since my kittens were weened, one if them often self-nurses.

At first it was kinda cute but she does it a lot now, seemingly when shes real happy, and she will fall asleep doing it.

I dont necessarily want to stop her as she seems to enjoy it but is there anything I can do to offer her an alternative form of... whatever that is to maybe cut back on it?

One of her siblings joins her now.

She's already fixed as well.",cats,6,https://www.reddit.com/r/cats/comments/17idl78/selfnursing_kitten/
2023-10-28,1698495825,My kittens paw looks like a cute tarantula&,Just thought I would share the cuteness :),cats,1,https://www.reddit.com/r/cats/comments/17icnww/my_kittens_paw_looks_like_a_cute_tarantula/
2023-10-27,1698372516,Introducing a new kitten??,"Hello,

My wife and I recently took another kitten home from a farm. She's 6 months old and female, and very cute. Our 3yro male cat was pretty upset when we brought her home. At first we kept them separated, not allowing them to interact at all. Then after a week we let them see each other a bit and the kitten was excited as hell to meet Alfred, but he was not into her at all, and was growling at her and hissing. Then after another week of gradual interaction, Alfred (male 3yro) wants to play with her, but shes now terrified of him, who is trying to play tag/chase, hide and seek stuff. 

Does anyone have experience with introducing a new kitten and have some tips to share? I've looked through several reliable sources on cat behavior and I'm wondering if there are things you all have tried that worked outside of: slow introduction, introducing scent to each other, keeping them separated, separate litter, food and water, separate beds, separate toys, etc...

One thing that breaks our heart is that Alfred always used to sleep in our bed with us at our feet, and now he won't come near us at night. Can we get him back???

&amp;#x200B;

Anyway, getting a second cat has proven more difficult than we wanted, but we really hope they will come to play with each other and at least tolerate each other. ",cats,3,https://www.reddit.com/r/cats/comments/17hczo3/introducing_a_new_kitten/
2023-10-25,1698265520,interaction with a random outside kitty!,"she was very very terrified of me until I started meowing and playing little kitten noises, hehe she meowed back! shes in my neighbours backyard which is very very cluttery and i thought I saw her go under his porch. a while back I saw a young black cat in his backyard as well and im certain these guys have to be related or something! one of my other neighbour told me how she had a cat under her porch that had kittens i think a year back now but J doubt these guys are related lol, im almost certain she isnt a stray but i know everyone around me quite well and i dont know who owns her!! She didnt end up coming to me, obviously, but she got kind of close and was meowing at me, its as so cute! A few days ago, she showed up in the tree in front of our house and my cat (Skipsy) was NOT happy about that. So from what I know she goes through our backyard to my neighbours back yard and maybe under his deck and then she goes home? What do you think? I dont want to feed her because i dont think feeding outdoor pet cats is smart but i also dont like outdoor cats, especially without collars =, i also might be wrong, but her fur looked a bit matted in some places? i will try to get a better look.",cats,1,https://www.reddit.com/r/cats/comments/17ge61b/interaction_with_a_random_outside_kitty/
2023-10-25,1698259293,New kitten is not a confident jumper,"This community has been so helpful for me! Now I have a question that might come off as overthinking, but oh well.

I adopted two brother kittens. I suspect they have different dads but same mom/same litter. 

The smallest one (brown tabby) is a great jumper! They're 15 weeks old and he's already jumping on the counters (which isn't my favorite thing but I do find it cool that he can already jump so high!)

The other one (orange tabby) is not a confident jumper at all and is quite clumsy in general. He can't jump on the counter and I've noticed when he jumps to his cat tree, he hesitates and it's kinda pitiful (in a cute way) when he does jump. And he's the same when he's jumping down, too. Which is strange considering he's bigger than the other one. 

When we are playing, he will jump for the toy but he just can't really jump very high at all lol. He will do the tiniest jump ever to get a toy way high in the air. Almost like he can't really tell how high he needs to jump lol. 

Meanwhile the other one is an honorary kangaroo (we even named him Roo). 

As far as I can tell (and I've already had their kitten vet visits and everything was normal), he's perfectly healthy and happy. He's just not a confident jumper. 

&amp;#x200B;

1. Should I be worried? 
2. Should I take him back to the vet and ask?
3. Assuming nothing is wrong, is there anything I can do to help him be more confident at jumping?

&amp;#x200B;",cats,2,https://www.reddit.com/r/cats/comments/17gbu0x/new_kitten_is_not_a_confident_jumper/
2023-10-25,1698253588,I can't stop thinking about getting a cat...,"Long story short, I grew up with two cats but moved out last year (three hours away from them &lt;/3) and I can't stop thinking about getting my own cat. I always knew I wanted one but my mom is very opposed to it because she hates how locked down she feels. I don't care, I think I was meant to own cats in my life. I don't want children, never wanted them, always wanted cats.

Browsed a local marketplace kind of thing for cats and found the most adorable kitten. Like, usually I can see a cat and be ""oh they're so cute! but nah... not for me!"" but this one? I totally fell in love? Then I found out the current owner has people over tonight to meet the kitten. BUT THE GOOD THING IS! He has a sister! And she's equally as adorable!

For the past 5 hours I haven't been able to stop thinking about finally getting a cat. Like, I can't relax. These two kittens I found completely won me over and I think, if I get the opportunity, I'm gonna go visit them.

Just felt the need to rant because I just love cats so much it's insane lol.",cats,3,https://www.reddit.com/r/cats/comments/17g9o5t/i_cant_stop_thinking_about_getting_a_cat/
2023-10-25,1698230966,Meet Spooky!,"My coworker gave me this 4-week old stray kitten, who I mistook for an older kitten in the pictures. She's very wobbly and shy but also very cute. She's still not out of her bumper car phase so her tail sticks right up when she walks. I'm trying to take care of her between my classes, so any tips are welcome!",cats,1,https://www.reddit.com/r/cats/comments/17g1yc3/meet_spooky/
2023-10-24,1698162599,Dont be Afraid of Drugs,"This is some advice for people with difficult, jumpy, kind of rude cats: try drugs. Disclaimer that this obviously isnt the solution for all or possibly even most cats with behavioral issues. 

My bf has a cat, Anakin, that we had to integrate into our household when we moved in together, and it has been an incredibly difficult transition for Anakin. We knew it would be hard because Anakin was already a stressed, anxious cat that would hiss at me for just existing. My bf is the only person he would act cute with and he would walk through the house keeping low and wary even in spaces he should feel comfortable.

I had two cats already who arent territorial and are pretty friendly to other cats, but Anakin wasnt having it. We followed all directions, keeping everyone separated, feeding through the door, pheromone sprays, play time, screen doors, treats, bed swaps, etc. Nothing mattered because no matter what, Anakin never felt safe or relaxed unless he was asleep. It wasnt outright aggression so much as panic constantly on the verge of defensive aggression. It didnt help that we stumbled across 3 baby kittens and their dead mother around our new home and were unable to find a shelter to take themwe spent the next month and a half finding homes for them and ending up keeping one. Ironically, Anakin was way more calm around the new kitten than my older cats.

Needless to say after 4 months of little to no improvement, we spoke with our vet, got a blood test, and they prescribed Anakin with Prozac. 

He is a new cat. He no longer exits his room hissing, he is staying level emotionally, and he is playing with and bathing the new kitten frequently. He honestly likes her a lot. I am astounded at how much happier he is. My cats still dont like him because he was rude (hissy/swatty) with them before, but they dont view him as a threat. He still acts like Anakin, still doesnt like me, but he no longer reacts like he expects the world to hurt him.

Im sharing this because basically everything I found online shared that basics and didnt address an already chronically anxious cat. On some Reddit posts, people were arguing its not right to drug a cat to make them happier/behaveI think thats a warped and damaging view that very much reminds me of why it took so long for ME to get medicated for MY anxiety. Animals can be just as unbalanced as humans and you dont get a gold star for suffering in life. It might not be right for everyone, but its been right for Anakin to have a little medical intervention for him to be happier. If youre in a similar situation its definitely worth talking to your vet.",cats,0,https://www.reddit.com/r/cats/comments/17ffzbj/dont_be_afraid_of_drugs/
2023-10-23,1698084114,Honest opinions,"Hi!  Meet my foster kitten, Zazu.  Zazu is the sweetest, chattiest little boy.  He loves to cuddle and he can do pretty much anything a sighted cat can do.  

Zazu came into the rescue with ocular herpes.  His third (inner) eyelids are fused to his eyes. I am fortunate to live a town away from a major veterinary hospital/school.  I picked Zazu up from his original foster at the end of August and he went in for surgery to loosen the lids in late September.  While there, the doctors confirmed he foes have some sight--he can see light and dark, but that's about it.  The eye on his right (our left if we're facing him) has glaucoma and is distorted by the pressure.  It may be painful but doesn't seem to bother him.  

The rescue has a difficult decision to make this week and I was asked to weigh in.  Here are the options:

1) remove the eye.  This leaves him a pirate kitty with one eye, an eye which is damaged but not painful or suffering glaucoma.
2) loosen the eyelid, with the knowledge he may need the eye removed later.  This may make him less adoptable.
3) do nothing, which means daily drops to relieve the pressure and he may still need the the removed later.  While he would keep the most sight this way, it means finding an adopter who is willing to fight moring and evening to get eye drops in and/or would be willing to remove the eye later.

Which brings me to why I'm here.  If it were me, I'd choose option three.  He'd keep the most sight that way.  But I also want him to have the happiest, best life which means finding a forever home.  And the harsh reality is the longer we try to treat the eyes, the older and less kitten-cute (and adoptable) he gets. 

So here are my questions:

1) do his eyes creep you out?  
2) would you be willing to adopt a one eyed cat?
3) what about no eyes?
4) what about wonky eyes like this?
5) what about a cat who might need expensive surgery?
6) or daily drops?",cats,3,https://www.reddit.com/r/cats/comments/17eqqgh/honest_opinions/
2023-10-23,1698044313,MIL says kittens have fleas and don't want them.,"My MIL has kittens on her garden. It is a very big garden and she also has chikens there. She had a cat which had 4 kittens which are in the garden now, but other stray kittens also eat from the same food. She says she doesn't want to feed the stray kittens 9 because they have fleas, and she feeds the other very little food because she doesn't want that it remains food for the other kittens. 

The poor kittens are continuously hungry and it breaks my heart. I feed them each morning because I work with my MIL and she got very angry the last day because I put them more food. 

What could be a solution for the stray kitten's fleas? I can't catch them, they run away when they see a person. But they are so cute I don't want them to be hungry. The mother of the kittens died hit by a car because my MIL wouldn't feed her enough and she went to look for food away from home until she got near the street and died 9 I don't want the same for this kittens, I see a lot of dead cats in the street here. 

What can I do? Is it there some product I can spread on the floor to kill the fleas? My MIL hates the fleas because she had goats which got very infected by fleas to the point the fleas infected her home and she says it was a nightmare to get rid of the fleas. I don't think two kittens with fleas could cause that too. Any idea? Thnak you!",cats,1,https://www.reddit.com/r/cats/comments/17eeccv/mil_says_kittens_have_fleas_and_dont_want_them/
2023-10-22,1698011323,Get a kitten they said. Theyre so cute they said.,I love her with my whole heart but my gosh are baby animals a lot to handle.,cats,461,https://www.reddit.com/r/cats/comments/17e4am0/get_a_kitten_they_said_theyre_so_cute_they_said/
2023-10-22,1697999738,It was finally our turn!,"My wife and I have been wanting to foster for a long time now but there was never a good opportunity for it. Unfortunately, 4 kittens were dropped off at my wife's work and without skipping a beat, my wife called me and said we HAVE to take them in. I happily obliged. :)

I quickly learned they're about 4 weeks old and realized we are gonna have our hands full. But man... these kittens sure are cute.",cats,3,https://www.reddit.com/r/cats/comments/17dzz8b/it_was_finally_our_turn/
2023-10-22,1697945099,Help! How can I coax this kitten to come to me? It is very skittish &amp; acts scared,Late this afternoon I heard this kitten crying inside my car I could not see it under the hood or from bellow so I placed some wet food down &amp; it came out on its own but it will not come near me. Now it's 10pm &amp; it's on my doorstep crying but it will not come to me. Im not really sure what to do with it anyways I have a indoor cat already &amp; we're pretty tight with money so idk how much it would cost to take it to the vet and get it shots &amp; stuff plus Idk how my cat would react I want to keep it but my husband does not lol. If I do get it to come to me idk what to do lol. I've posted on local lost pets so far nothing and neighbors aren't claiming it. 2nd picture looks like there's a whole litter out there lol but it's just the reflection from my door it's just one cute orange kitty.,cats,24,https://www.reddit.com/r/cats/comments/17dk2u4/help_how_can_i_coax_this_kitten_to_come_to_me_it/
2023-10-22,1697938330,Kitten in a basket,This cute kitten was being cared for by the owner of the shop.,cats,8,https://www.reddit.com/r/cats/comments/17dhz8t/kitten_in_a_basket/
2023-10-20,1697811246,My recently adopted kitten discovered its not a good idea to mess with Syrups pillow,"I thought this photo was too funny not to share.

My 3yo cat, Syrup, sleeps on my second pillow every night. Two nights ago the kitten, Benny, was laying on the edge of the pillow and Syrup started cleaning him. It was so cute until Benny started trying to play with Syrup and he got annoyed after a bit which led to this stand off over the pillow.

Anyways the battle ended with Syrup on his pillow and Benny slept on my stomach. 

Good news though last night they shared the pillow with no disturbances.",cats,0,https://www.reddit.com/r/cats/comments/17cca3z/my_recently_adopted_kitten_discovered_its_not_a/
2023-10-19,1697731654,Help - Stray cat with litter decided to stay in my shoe rack,"The shoe rack is in our balcony. 

So I saw my old shoes and the paper bag tossed out of the shoe rack and decided to investigate and I found this mama cat with her cute litter.

I don't really know what to do. I'm happy that I get to care for cats :). I have put a bowl of warm water outside for her and the kittens.

Any advice would be much appreciated.",cats,5,https://www.reddit.com/r/cats/comments/17bmq8a/help_stray_cat_with_litter_decided_to_stay_in_my/
2023-10-19,1697723548,"cute kittens cheer me up, just look how cute this baby is :)",,cats,0,https://www.reddit.com/r/cats/comments/17bjo3e/cute_kittens_cheer_me_up_just_look_how_cute_this/
2023-10-17,1697517933,Is there a reason my cat is so vocal?,"Hi! I have two kitties both around 7 months. One of them is super vocal. He yowls and cries all the time. Its not boredom- hes played with constantly, has plenty of toys when not explicitly played with, and is constantly playing with our other kitten. He also shows no other signs of boredom. Well taken care of as far as necessities as well. 

It mainly happens whenever one of us closes a door (usually the bathroom, we almost never close them out of a room were in) but also happen at other random times.  Its also not just yowling- he makes little sound effects when he moves. A tiny yelp (bad choice of word but cant describe it any way else but its not in pain, just like a short sound but not a meow) every time he jumps. It reminds me of when a character jumps in a video game and makes a small sound, its kinda cute except for when he jumps at night when im trying to sleep lol. 

Kitty shows no signs of unhappiness. Shows all signs of affection to us, loves to cuddle and be held. Makes biscuits, nuzzles on us, all the signs of comfort. Purrs allll the time and his purring is also super loud too if that means anything. Also 100% positive that the yowling is never to ask for food or water or to change the litter btw- very on top of that. 

 Im just wondering if theres any possible reason for this or if its just part of his personality. The yowling can get a bit annoying honestly- I have to distract him with a laser pointer whenever my bf goes to the bathroom lol. Other than that no concerns with his health or happiness, just curious about causation. Other kitty only meows for specific reasons so definitely adds to my curiosity on this one. 

Thank you!! (Also cat tax added, hes sleeping cuddled next to me right now &lt;3) (Also this isnt necessarily a medical question it was just the closest flair lol)",cats,42,https://www.reddit.com/r/cats/comments/179qbwm/is_there_a_reason_my_cat_is_so_vocal/
2023-10-17,1697503781,"Everyone wants people to share cute pics of your kitties, show me your kitten war faces!",,cats,9,https://www.reddit.com/r/cats/comments/179ls9g/everyone_wants_people_to_share_cute_pics_of_your/
2023-10-16,1697498488,What in the actual kittens cuteness is he doing.,My boy gets under the chair and then just scratches it with his back paws. Does this when hes crazy.,cats,0,https://www.reddit.com/r/cats/comments/179jxbj/what_in_the_actual_kittens_cuteness_is_he_doing/
2023-10-16,1697421746,my new cat is terrified of my resident cat,"so a few months ago i took in a stray cat. she was due for kittens around the same time, and her babies were born in my house. i have a seperate room for the new cat and her kittens. my plan was to foster them and give them all away, but i love the mom cat and really want to keep her, shes super cute and very loving. 

the problem is my resident cat. shes around 10-11 years old, and also a stray cat. i found her when she was about two months old. 
at first, before i took in the new cat, they were interacting through the door. my resident cat tried to attack her through the door. when i moved the new cat inside and into her room, she quickly accepted the room as the new cats territory and wouldnt go inside. 

its been hard doing the room swapping method with the kittens. but the kittens are about to go to their new homes, and ill be able to focus on them. 
but as of now, when i do supervised face to face interaction my resident cat has been so nasty to the new cat that shes horrified of her. 

when she wants to come out of her area, they normally avoid each other, but when my resident cat comes near the new cat will walk away and tuck her tail away and look really afraid. shes chased her, tried to  swipe at her. 
and i know straight up exposure is not the way. ive never done this in my life and i need some help. i want them to at least accept each other. do i need to restart this process? will it even work if i try again? or do i just have to wait. 
i was thinking maybe after i got my new cat fixed it would make a difference? 
what do you all think",cats,0,https://www.reddit.com/r/cats/comments/178v5ma/my_new_cat_is_terrified_of_my_resident_cat/
