date_utc,timestamp,title,text,subreddit,comments,url
2023-11-13,1699888363,Clingy Cat,"I recently got 2 new kittens, both of them are a few months old. One of them is so clingy and no matter how many times I push her off she comes back. It was cute the first week and ive been letting her and petting her when she does come but its really starting to piss me off.

I know it sounds cruel but its really been messing with my life, like when Im trying to work she jumps on my lap, claws beared, and starts climbing me. I still have multiple cuts there. And its like she has no brain i swear =- when i push her off she comes right back, even if i do so 10+ times in a row. 

Even when Im relaxing or watching TV, she comes up to my face and starts rubbing off on me so hard I dont know whats up with her, she wont even let me look away, and I cant even cook or eat without her jumping and trying to steal the food, when i push her she comes back again and i have to lock her in another room. Her sibling doesnt do any of those things. Do you have any advice on how to help with this? Or do i have to suck it up?",cats,2,https://www.reddit.com/r/cats/comments/17ucqv0/clingy_cat/
2023-11-12,1699825251,Cute kitten goes nini,,cats,1,https://www.reddit.com/r/cats/comments/17tuka9/cute_kitten_goes_nini/
2023-11-12,1699798269,Cats opening air vents,"We have two kittens Howie (9 months) and Kirk (5 months).

When we only had Howie and he was staying in a bedroom, he has pulled out the air vent cover but luckily did not go inside. We were super paranoid and we put his cat scratcher half on it so he couldnt lift it. That was the end of that issue and we were able to take the cat scratcher off the vent because Howie had no interest anymore. 

Kirk has been with us for a bit over 3 months and is fully comfy. Hes an orange cat and he loves getting into things, the curtains, the blinds, the tv stand, and most recently - the air vent covers. 
We put the heat on for the first time this season and he laid on the vent which was super cute and he enjoyed the warm feeling, but this morning he has pulled the cover out. I put a heavy box of litter on the corner so that he couldnt lift it but hes been going at it anyways. Writing this post Ive had to stop to remove him from the area 3 times, and then turn the heat off. 
Generally we would just put something on it like Ive just done with the one hes fixated on, but I fear he would try the other vents after awhile. We have about 6 just on the main floor alone and one in their cat bedroom. 

Ive attached photos of the vent cover, they are made of plastic and are very light. I was curious if anyone has any tips or tricks to help, or if anyone thinks it would be a good idea to buy metal covers that are a bit heavier? 

Also what would we do if he DID open it and climbed inside where we couldnt get him? 

Thanks in advance! :)",cats,1,https://www.reddit.com/r/cats/comments/17tl0br/cats_opening_air_vents/
2023-11-12,1699769659,Bamboozled by shelter cat,"This is Aveline. Aveline was a colony kitten that was to be TNVR but somehow tricked the staff into thinking she's social so they put her on the adoption path after she already had her surgery and ear tipping. Her cute little face and the cuddles she offered got me when I met her at 3 months.

This was all a LIE. Little miss isn't exactly antisocial, but she's not a cuddler and won't let me touch her (she will play and has slowly started creeping closer to me).  She is LIVING IT UP though. The only one of my cats that doesn't even glance at an open door. Little girl knows she has it made because I'm an absolute sucker for my cats and she is using it to her advantage = I gotta respect her hustle, she saw someone with no backbone and jumped on that. She was an old cat in a kitten body, never had a kitten phase (having zoomies now, though). She's less ""my cat"" and more ""my roommate"". 

She pays rent by killing and eating any bugs she finds. I love her so much. Happy first birthday!",cats,1,https://www.reddit.com/r/cats/comments/17te5hm/bamboozled_by_shelter_cat/
2023-11-11,1699720677,I'm curious what color my kitten will turn out to be.,"I've never had kittens before, he was born completely white and started showing gray lines. He's so cutee >p",cats,6,https://www.reddit.com/r/cats/comments/17sy66f/im_curious_what_color_my_kitten_will_turn_out_to/
2023-11-11,1699670075,Dont be fooled & Rare photo,"Hes cute as a little button, but holy cow, hes busy!! This is the usual nighttime routine:

Me: *shuts light off*

The kitten?

Saucer eyes: ENGAGED
Night vision: ACTIVATED 
Its time to F*** S*** up!!!

(Last night he decided the pumice stone was the bees knees toy of all time. I found it under the dining room table this morning) =D=",cats,0,https://www.reddit.com/r/cats/comments/17skqv5/dont_be_fooled_rare_photo/
2023-11-10,1699624290,Name Requests - For our future Siamese girl,"[https://imgur.com/a/EpnhO48](https://imgur.com/a/EpnhO48)

&amp;#x200B;

https://preview.redd.it/bydsumckeszb1.jpg?width=1765&amp;format=pjpg&amp;auto=webp&amp;s=f51a0cb9200e21b296ef77cdfde8380a3b57b98d

https://preview.redd.it/5yjw1pckeszb1.jpg?width=3000&amp;format=pjpg&amp;auto=webp&amp;s=140ce78d2159d3b8b3f2093275934b059d5b6025

&amp;#x200B;

We went today to see the kitten we were told about, and so far she seems absolutely adorable. As she's still young (Under a month old) we haven't taken her yet and will be waiting until she's older, but she's ours. I was pretty focused on her and making sure she stayed safe so I don't have a lot of photos but I caught some pretty cute ones, especially of her with her grandma (The mother of the cat that had the litter)

We're looking for a name that would work well alongside Ice (Our older Siamese cat) and we came up with some names but I dunno about them, not sure. We still have a few weeks to decide on a name (The ones we came up with are Kassie/Cassie, Mist/Misty, and Sky because idk it's a cute name)

&amp;#x200B;

&amp;#x200B;

&amp;#x200B;

Edit:

Our top name ideas are Kassie/Cassie, Sky/Skye, Kalie/Caile, Kari and Nix/Nixy/Nixie

Better photos of the little princess

&amp;#x200B;

&amp;#x200B;

https://preview.redd.it/oq0s4wjneszb1.jpg?width=418&amp;format=pjpg&amp;auto=webp&amp;s=acc1f9b06c0a7f823ea4b5c1be71d861985b4fe6

https://preview.redd.it/ud5qqyjneszb1.jpg?width=542&amp;format=pjpg&amp;auto=webp&amp;s=5fc14bccd79dc4bd95c117df145a5ce494b58a4f

https://preview.redd.it/it6is1kneszb1.jpg?width=579&amp;format=pjpg&amp;auto=webp&amp;s=402c91afb50c2d72f0cab844a35772ec5c1676a5",cats,1,https://www.reddit.com/r/cats/comments/17s4fz7/name_requests_for_our_future_siamese_girl/
2023-11-10,1699578400,Christmas and cats - raw post out of my love for these emotional furryballs,"If my post goes against the rules, ignore it totally or take it down. Not sure about the flair either because I want to give a form of advice...? 

My mini-story is in regards to cats and this time of the year, which is coming fast, and is intended as a reminder for the people who think about adopting one of these sweethearts into their lifes:
Cats are in no way, shape or form, Christmas Presents for children to play with.

They aren't plushies or dolls or toys either.

They are fully sentient beings (like any other animal for that matter) who has feelings and emotions as well as a personality.

It happens way to often that people adopt cats as a present for their children to play with and then dispose of them like used clothes as they aren't perfect, not cuddly enough, or just get too old (not the cute kittens anymore).

As a matter of fact, one of my neighbors adopted 2 baby kittens as a Christmas present for their children, although the father had a known allergy towards cats, and made a special request for them to be from a farmland as to be able to lock them out in a garden shed for the night... In the winter... In the Alps... Not even a couple of months old kittens fresh from the tit... With temperatures going easily into the minus in Celsius for months on end, without a Heather, and snow...so much snow... 

1 of them, little baby girl tri-colour, ran away after 2 weeks of this treatment and the other one, little black baby boy with a white belly, was always sniffing more and more loudly. We saw it because since he was hours upon hours out during the day as well, shaking with cold, we opened our home to him alost everyday. 

We warned the owners that he was getting really sick and could possibly not sniff or worse, breathe anymore at some point and to go to the vet ASAP. To what they answered that they know and just gave him some arnica. 

We even called the relevant authorities and associations to ask what we should do. And we couldn't do anything but eventually kidnap him and bring him somewhere where he will be treated properly. No need to say that it will be suspicious for this baby purr to disappear after our conversation with the neighbors... 

Not even 3 months later, in the springtime, the poor baby was breathing extremely loudly and had lost the flame in his eyes and soul. Wasn't playful anymore, just inactive. Sitting there just looking at the tiles. The small, cuddly, curious and happy little kitten was a shadow of himself. And then...a couple of weeks later...you can imagine what happened. 

End of the story. And I could see this story repeat over and over and over again. As well as with the ones abandoning their animals on the highway to holiday! 

Again the reminder:
So please people, if you want to adopt a cat, then wonderful but please be aware again that your cat is going to be a full-fledged family member. They are going to stand with you in the happiest and the hardest time and give all the love they can to cheer you on. So please, treat them as such. They deserve respect and be accepted as they are.

They are not ""used stuff"" on which we have a 30 days buy back warranty. And for cats as for humans, if they are abandoned once, who says the new owner will not do the same? So time for their trust building they need. 

And spoiler: these tiny kittens are going to grow up. They evolve and will then have another type of cuteness. Not the baby face so much, but their eyes and paws and and and... 

And again cats aren't toys, cats aren't dolls, cats aren't plushies, cats aren't christmas presents to offer to your children.

They are going to be your family for 20 years. 

Finally, a point that enrages me: stop putting your cat's plates with food and water right next to the litter box and complain that they don't use said litter box. I mean dude, do you eat where you shit? 

And if you know somebody planing on this, please persuade them not to. They must find another plan for Christmas and especially, the decision has to be made by everybody in the family involved.

Thank-you for coming to my late night MADCAT-talk",cats,4,https://www.reddit.com/r/cats/comments/17rsarc/christmas_and_cats_raw_post_out_of_my_love_for/
2023-11-09,1699545087,My Son the Menace,"Hey Friends 

I've got the cutest little kitten, around 7 months old. Some context is we adopted him from my sister a few months ago. She is 16 and adopted him from a stranger on FB Marketplace and then about 2 weeks later decided she couldn't take care of him. After a stern talk with her, we (my BF and I) took little guy in. Now, I have no experience with Cats or how to take care of them. I've been a dog person all my life. My boyfriend though, loves them. So it's been fun learning how to care for a cat. He is a good natured little guy, but an absolute menace. He loves to pounce on anything that slightly moves, always exploring and getting lost/stuck in our apartment, and playfully assassinating my dog every second he gets. He is normally too busy being rambunctious and curious to want any sort of cuddles or attention. (which is totally fine. I know he is a cat and I think it is cute, albeit a little tiring sometimes)  The most he does, is when he takes a nap, he prefers to do it as close to my face as he can regardless of what I'm doing lol. 

Lately, I have noticed that in the mornings he acts like he is absolutely STARVED for attention. At first I thought this was because of our sleeping arrangements. At night we would have the dog and cat sleep separate, have the dog in the bedroom with us, and let the cat explore the apartment at night. We mainly did this while introducing the dog and the cat to living with each other, and have since then slowly allowed the cat to have access to sleep with us during the night. Our current arrangement is he gets most of the night, but most times, my boyfriend will move him to the hallway on his 5am bathroom trip if the cat is hunting our toes. I get up for work around 630 every morning. When I open the door to see him, he runs over screaming for attention. I playfully talk with him, and go about my morning routine with the little observer. It has slowly been getting worse, lately he has just acted like it's been years since he sees me, and often tries to claw his way up to my face. If I pick him up or whatever he will headbutt me a thousand times in the face. It is so bad that if I am in the bathroom doing makeup, going to the bathroom, or brushing my teeth he will claw at me until I allow him to headbutt me. If I try to put him down too soon, he will literally hold on to me with all his claws. It has gotten to be both a time suck and very very painful as now my arms, chest and little of my neck have little scratches and puncture wounds from him. He doesn't seem to do this with my partner.

I've tried googling some research and it all is kind of inconclusive. Some articles say that he is just hungry, so I tried brining him to his food bowl when he acts like this, and he just jumps down and tries to climb up me again, sometimes I turn the sink on low so he can drink from it while I put on makeup and sometimes that works for a little bit, but he goes right back to wanting attention. Another article says he is worried about my health? I did just get diagnosed with Hypertension just recently, but  regardless of the recent diagnosis, I have had it for a while. My boyfriend says that ""he just really likes you"" and maybe that is true, but it feels like he is so desperate in the morning for it to simply be his favorite human. I also considered that he does just simply miss us during the night, but if I try to get him to come lay with us in bed, he typically refuses and leaves to go play somewhere else. 

I just want to make sure I am not missing a clear sign from this cat that he needs something. 

oh and for the record, my dog and cat seem to get along fine. The dog is around 12 and is just content sleeping, eating and getting back rubs and overall seems unphased or unbothered when the cat launches an aerial attack.",cats,9,https://www.reddit.com/r/cats/comments/17rfz4b/my_son_the_menace/
2023-11-09,1699536309,the time this cute little kitten crawled into my jacket and fell asleep at a cat cafe &lt;333,,cats,0,https://www.reddit.com/r/cats/comments/17rcvdi/the_time_this_cute_little_kitten_crawled_into_my/
2023-11-08,1699484903,Peak cute: Four-month-old rescue kittens snuggling on top of me =;,,cats,0,https://www.reddit.com/r/cats/comments/17qyiud/peak_cute_fourmonthold_rescue_kittens_snuggling/
2023-11-08,1699423622,My Kitten + ID?,"My newest kitten pepperHe is 4 weeks, &gt;1 month, 1.5 months, and current 6 months old in these photos 

Hes abnormally large, big poofy tail, and has cute tufts coming out of his ears making me wonder what breed/cross breed he may be. Right now hes 11 pounds as a 6/7 month old and not at all over fed just a big boy. any cat lovers have a possible ID for this boy?",cats,2,https://www.reddit.com/r/cats/comments/17qfcjn/my_kitten_id/
2023-11-08,1699415440,Are there more cats that are overly affectionate?,"Hes done this ever since he was a kitten, he always comes up to me and purrs nonstop, rubbing against me. When I lay down, he lays down on top of me, gets up, and lays on top of me again. Like he flops himself on my face and purrs. He paws at my face and rubs against it nonstop for minutes on end, then goes on to making biscuits. Its pretty cute but also annoying cause he does this while Im sleeping for school. He restlessly does this, usually only with me. I dont think Ive heard of a cat being THIS affectionate. Like this is part of his daily routine, he does this multiple times a day. My other cats are affectionate, but he just bugs you nonstop rubbing against you and purring lol 
He does other stuff like chirps to greet me and nuzzles my face when I walk by but thats just cat stuff I guess haha
Dont really know what to tag this I kinda just wanted to talk about it",cats,5,https://www.reddit.com/r/cats/comments/17qd5cr/are_there_more_cats_that_are_overly_affectionate/
2023-11-07,1699393913,If you have a tiny kitten please show me,Here's all 6 of my cats when they were kittens! I want to see some smol cute little faces!,cats,4,https://www.reddit.com/r/cats/comments/17q5lbs/if_you_have_a_tiny_kitten_please_show_me/
2023-11-07,1699317203,Littermates just spayed and neutered,"Hi all! The universal cat distribution system hit me again last week with two 6 month old strays(1 boy, 1 girl). I got them fixed today and the vet said they need to stay apart for 24-48 hours minimum while the anesthesia wears off and more if they cant stay calm so Luna(little girl) doesnt pop a stitch. I cleared out both the bathroom and the laundry room for a cute little set up per kitten. 

The problem is they cry and scratch at the door non stop unless Im in the room or theyre together. I tried rotating between rooms for snuggles, ignoring the cries hoping they would calm down, and letting them be together under supervision. Problem is Harry(little boy) is extremely interested in Lunas incision and is also more awake and wants to play. She actually started hissing at him the second time and I separated them again-cue the crying starting back up. 

My adult male cat(Voldemort) is not interested but my female adult(Hermione) has been hanging out at Lunas door very concerned with her crying in particular.  Luna does not want to be friends however and was hissing at Hermione too, so I moved my adult cats away to not stress her out more. Hermione is hanging out at Harrys door now. 

Any advice or tips? TYIA!!

(Yes Im a huge Harry Potter nerd what gave it away lol)",cats,1,https://www.reddit.com/r/cats/comments/17phtm3/littermates_just_spayed_and_neutered/
2023-11-04,1699120944,My new kitten found her a new mommy!!,"So, like, a week ago I brought home this adorable white kitten. I haven't given her a name yet, but she's super cute! Anyway, when I first introduced her to Midnight, my black cat, she wasn't too thrilled. She would hiss and swat at her for the first few days. Now, here's the crazy part: Midnight had her own kittens like 6 months ago. And guess what? This morning, when I let the little white kitten out of her cage, she went up to Midnight and started nursing! It's like they're one big happy family, still going strong. It's just too cute for words! >z>z
",cats,6,https://www.reddit.com/r/cats/comments/17nraz9/my_new_kitten_found_her_a_new_mommy/
2023-11-04,1699118294,My 1 year old male cat Dave has really taken to the kittens Terrence and Deborah and its so cute =),Terrence is in the middle being cuddled by Dave and Deborah is on the cat cushion,cats,9,https://www.reddit.com/r/cats/comments/17nqe2f/my_1_year_old_male_cat_dave_has_really_taken_to/
2023-11-04,1699080594,My cat Calcifer& before he became morbidly obese,He was such a cute kitten. Now he eats all of my other cats food all the while preaching of body positivity. Calcifer& you cheeky mf.,cats,6,https://www.reddit.com/r/cats/comments/17nfwgl/my_cat_calcifer_before_he_became_morbidly_obese/
2023-11-03,1699048483,First time cat dad- cat meows and seeks me out when she wakes up,"Got these two little monsters over the summer. Having never raised kittens (or any animal really) by myself before I wasnt quite sure what I was getting into, but I got 2 from the same litter because everyone said two was easier than one. Theyre some of the sweetest, most affectionate cats Ive ever met. Sometimes to the point of being slightly annoying because they want to be on me constantly and follow me wherever I go.

Peach (the white and orange one, on the left) is especially needy (not in a traumatized or distressed way, she just really loves attention) and meows and looks around for me immediately after she wakes up from naps. Just wondering why she does this or if anyone elses cats do this cuz I think its kinda cute.

Anyway just wanted to gush about my girls for a minute. Im a proud cat dad. For anyone curious, the calicos name is Charlotte.",cats,6,https://www.reddit.com/r/cats/comments/17n669b/first_time_cat_dad_cat_meows_and_seeks_me_out/
2023-11-03,1699031716,What names do your cats have that aren't their given names?,"Inspired by a post I saw on r/puppy101... what things do you call your cat that aren't their name or what evolutions has their name gone through? (I hope this doesn't violate Rule 10, I just thought it was cute to see what nicknames pets have.)

We don't go too far off of the original names for our cats.

We have one cat named Riley... we call him \[Insert any letter/sound here\] plus -iley. Riley, Piley, Biley, Riley-acting-so-shy-ley, Cry-ley, Why-ley...

We have another named Kitten/Tuxedo Mask. She is Kit-kat, Kitten-bo-bitten, Kitchen, Chin-chin, Tuxothy...

I think my favorite evolution of cat names comes from my sister though. Licorice &gt; Licko &gt; Lickopotamus &gt; eventually everyone just called the cat Potto.  ",cats,18,https://www.reddit.com/r/cats/comments/17n00xd/what_names_do_your_cats_have_that_arent_their/
2023-11-03,1698987345,PSA to everyone looking to adopt a kitten soon: adopt a pair!!!!,"my mom and i went into the shelter together planning to adopt one kitten...but all the posters about how its better to adopt a pair got to us. also, the fact that we couldnt choose only one. these two, Serrano (tabby) and Leonidas (tux) were in the shelter together and staying in the same room. they werent born brothers, but they sure are brothers now. even though we spent way more money adopting than we had planned on&it was worth it. and so far, it has 100% been easier to raise two cats together than one cat alone.   

so, my dear friends, i just wanted you to know that you will NOT regret adopting a pair. its truly one of the most special things ever to have two kittens and watch them grow into cats. its so much easier to take care of them too, as they entertain each other, and its so cute watching them interact and learn together. they play, groom, fight, explore&all the things, they do it together, and its so precious. would highly recommend &lt;3 

ps. i understand not being financially or reasonably able to adopt two pets at once but if you can, in any way shape or form, adopt a PAIR of kittens&do it.

to everyone who has adopted a pair, please feel free to share with me !!",cats,4,https://www.reddit.com/r/cats/comments/17mne2n/psa_to_everyone_looking_to_adopt_a_kitten_soon/
2023-10-30,1698700382,"I fell in love with this cute kitten d=",,cats,1,https://www.reddit.com/r/cats/comments/17k3vg7/i_fell_in_love_with_this_cute_kitten/
2023-10-30,1698691796,The kitten in my backyard is so effin cute. Love how shes grown up.,,cats,2,https://www.reddit.com/r/cats/comments/17k0k4t/the_kitten_in_my_backyard_is_so_effin_cute_love/
2023-10-30,1698660706,"Can you spot the kitten?=1This sweet girl somehow snuck into the restaurant I work at. My co worker took her home for now, my bf and I will be adopting soon! Any advice?","Bf grew up with cats but I know nothing about them other than theyre so funny and cute! We also have a Doberman who is away and will be back in 2 weeks, he is a gentle giant so we feel theyll like each other but are prepared to do whats necessary to properly introduce. I know a lot about dogs and our boy is well trained so Im just more so looking for advice on how to make the kitten comfortable with him. Also can anyone guess how old she is? She will be taken to the vet asap when we have her in our care. Not too sure on a name yet, suggestions welcome!",cats,44,https://www.reddit.com/r/cats/comments/17jq24v/can_you_spot_the_kittenthis_sweet_girl_somehow/
2023-10-30,1698628486,Just cute kittens having a silly little time=:=,,cats,0,https://www.reddit.com/r/cats/comments/17jhugi/just_cute_kittens_having_a_silly_little_time/
